Option,Best For,Included Seats,Term,Draft Price,Notes
Founding Pilot,First university cohort,Up to 100,6 weeks,$2500,Pilot fee credited toward annual subscription if signed within 30 days
Expanded Pilot,Multiple sections or offices,Up to 250,8 weeks,$5000,Use when more than one course or office participates
Custom Pilot,Larger or multi-language launch,Custom,6-12 weeks,Quote,Scope around cohort size reporting and support needs
Institution Plus,One class club or small program,50-100 seats,Annual,$6000-$10000,Effective rate around $100-$120 per learner per year
Institution Pro,Department or study abroad office,101-500 seats,Annual,$12000-$35000,Includes stronger cohort management and reporting positioning
Institution Premium,Multi-department or campus program,501+ seats,Annual,Custom,Volume-based pricing and custom commercial terms
